[
  {
    "id": "EMA-KM-0001",
    "title": "Freedom of Information Act, Chap. 22:02",
    "record_category": "Legislation / Legal Instrument",
    "programme_area": "Cross-cutting",
    "gazette_section": "Section 8(1)(a)(i)",
    "year": null,
    "source_status": "Held by EMA — Request Required",
    "access_route": "EMA Information Centre",
    "source_url": null,
    "direct_url": null,
    "source_reliability": "Gazette-confirmed EMA holding",
    "custodian_or_owner": "Legal Services / relevant technical unit",
    "km_value": "Authoritative legal reference",
    "priority": "High",
    "action_needed": "Request access through EMA Information Centre",
    "notes": "This document is referenced in EMA’s Updated Public Statement 2024 and should be held by or accessible through EMA. No public online copy is currently linked in this register. Request access through the EMA Information Centre.",
    "has_source_url": false,
    "has_direct_url": false,
    "keyword_common_group": [
      "ema",
      "environmental management",
      "governance",
      "foia",
      "public statement"
    ],
    "keyword_unique": [
      "freedom of information act chap 22 02",
      "ema km 0001",
      "freedom information",
      "freedom information act",
      "freedom"
    ],
    "keyword_discretionary": [
      "law",
      "legal notice",
      "statutory instrument",
      "rules regulations",
      "compliance reference",
      "held by ema",
      "ema information centre",
      "request access",
      "gazette confirmed",
      "information centre request"
    ],
    "keywords": [
      "ema",
      "environmental management",
      "governance",
      "foia",
      "public statement",
      "freedom of information act chap 22 02",
      "ema km 0001",
      "freedom information",
      "freedom information act",
      "freedom",
      "law",
      "legal notice",
      "statutory instrument",
      "rules regulations",
      "compliance reference",
      "held by ema",
      "ema information centre",
      "request access",
      "gazette confirmed",
      "information centre request"
    ],
    "search_text": "freedom of information act chap 22 02 cross cutting legislation legal instrument section 8 1 a i held by ema request required ema information centre held by ema request access through the ema information centre this document is referenced in ema s updated public statement 2024 and should be held by or accessible through ema no public online copy is currently linked in this register request access through the ema information centre ema environmental management governance foia public statement freedom of information act chap 22 02 ema km 0001 freedom information freedom information act freedom law legal notice statutory instrument rules regulations compliance reference held by ema ema information centre request access gazette confirmed information centre request",
    "is_internal_ema_record": false,
    "source_type": "ema_information_centre_request",
    "source_label": "Held by EMA. Request access through the EMA Information Centre.",
    "source_placeholder": "EMA_INFORMATION_CENTRE_REQUEST",
    "availability_note": "This document is referenced in EMA’s Updated Public Statement 2024 and should be held by or accessible through EMA. No public online copy is currently linked in this register. Request access through the EMA Information Centre.",
    "has_source_pathway": true,
    "has_request_pathway": true
  },
  {
    "id": "EMA-KM-0002",
    "title": "Environmental Management Act, Chap. 35:05",
    "record_category": "Legislation / Legal Instrument",
    "programme_area": "Cross-cutting",
    "gazette_section": "Section 8(1)(a)(i)",
    "year": null,
    "source_status": "Official EMA linked",
    "access_route": "EMA website / Google Drive",
    "source_url": "https://www.ema.co.tt/ema-legal/legislation/",
    "direct_url": "https://drive.google.com/file/d/1xtZ1yBGm8AD1zGuyyeXng70qdbpkpyhV/view?usp=sharing",
    "source_reliability": "Official EMA",
    "custodian_or_owner": "Legal Services / relevant technical unit",
    "km_value": "Authoritative legal reference",
    "priority": "High",
    "action_needed": "Capture metadata and version",
    "notes": null,
    "has_source_url": true,
    "has_direct_url": true,
    "keyword_common_group": [
      "ema",
      "environmental management",
      "governance",
      "foia",
      "public statement"
    ],
    "keyword_unique": [
      "environmental management act chap 35 05",
      "ema km 0002",
      "act chap",
      "act",
      "chap"
    ],
    "keyword_discretionary": [
      "law",
      "legal notice",
      "statutory instrument",
      "rules regulations",
      "compliance reference",
      "legislation legal instrument",
      "cross cutting",
      "section 8 1 a i",
      "official ema linked",
      "ema website google drive"
    ],
    "keywords": [
      "ema",
      "environmental management",
      "governance",
      "foia",
      "public statement",
      "environmental management act chap 35 05",
      "ema km 0002",
      "act chap",
      "act",
      "chap",
      "law",
      "legal notice",
      "statutory instrument",
      "rules regulations",
      "compliance reference",
      "legislation legal instrument",
      "cross cutting",
      "section 8 1 a i",
      "official ema linked",
      "ema website google drive"
    ],
    "search_text": "environmental management act chap 35 05 cross cutting legislation legal instrument section 8 1 a i official ema linked ema website google drive ema environmental management governance foia public statement environmental management act chap 35 05 ema km 0002 act chap act chap law legal notice statutory instrument rules regulations compliance reference legislation legal instrument cross cutting section 8 1 a i official ema linked ema website google drive",
    "is_internal_ema_record": false,
    "source_type": "public_or_external_link",
    "source_label": null,
    "source_placeholder": null,
    "availability_note": null,
    "has_source_pathway": true,
    "has_request_pathway": false
  },
  {
    "id": "EMA-KM-0003",
    "title": "Air Pollution Rules, 2014",
    "record_category": "Legislation / Legal Instrument",
    "programme_area": "Air",
    "gazette_section": "Section 8(1)(a)(i)",
    "year": "2014",
    "source_status": "Official EMA linked",
    "access_route": "EMA website / Google Drive",
    "source_url": "https://www.ema.co.tt/ema-legal/legislation/",
    "direct_url": "https://drive.google.com/file/d/1MHksVyf46mYErOtTAjbVUKOMZm0b9VOs/view?usp=sharing",
    "source_reliability": "Official EMA",
    "custodian_or_owner": "Legal Services / relevant technical unit",
    "km_value": "Authoritative legal reference",
    "priority": "High",
    "action_needed": "Capture metadata and version",
    "notes": null,
    "has_source_url": true,
    "has_direct_url": true,
    "keyword_common_group": [
      "air pollution",
      "air quality",
      "source emitter",
      "ambient monitoring",
      "air permit"
    ],
    "keyword_unique": [
      "air pollution rules 2014",
      "ema km 0003",
      "air pollution 2014",
      "air",
      "law"
    ],
    "keyword_discretionary": [
      "legal notice",
      "statutory instrument",
      "rules regulations",
      "compliance reference",
      "legislation legal instrument",
      "section 8 1 a i",
      "official ema linked",
      "ema website google drive",
      "official ema",
      "air pollution rules 2014 index 1"
    ],
    "keywords": [
      "air pollution",
      "air quality",
      "source emitter",
      "ambient monitoring",
      "air permit",
      "air pollution rules 2014",
      "ema km 0003",
      "air pollution 2014",
      "air",
      "law",
      "legal notice",
      "statutory instrument",
      "rules regulations",
      "compliance reference",
      "legislation legal instrument",
      "section 8 1 a i",
      "official ema linked",
      "ema website google drive",
      "official ema",
      "air pollution rules 2014 index 1"
    ],
    "search_text": "air pollution rules 2014 air legislation legal instrument section 8 1 a i official ema linked ema website google drive air pollution air quality source emitter ambient monitoring air permit air pollution rules 2014 ema km 0003 air pollution 2014 air law legal notice statutory instrument rules regulations compliance reference legislation legal instrument section 8 1 a i official ema linked ema website google drive official ema air pollution rules 2014 index 1",
    "is_internal_ema_record": false,
    "source_type": "public_or_external_link",
    "source_label": null,
    "source_placeholder": null,
    "availability_note": null,
    "has_source_pathway": true,
    "has_request_pathway": false
  },
  {
    "id": "EMA-KM-0004",
    "title": "Air Pollution (Fees) Regulations, 2014",
    "record_category": "Legislation / Legal Instrument",
    "programme_area": "Air",
    "gazette_section": "Section 8(1)(a)(i)",
    "year": "2014",
    "source_status": "Official EMA linked",
    "access_route": "EMA website / Google Drive",
    "source_url": "https://www.ema.co.tt/ema-legal/legislation/",
    "direct_url": "https://drive.google.com/file/d/1R1dGwMrP8GKUuXrD0_X-lA-VAFjoqEX6/view?usp=sharing",
    "source_reliability": "Official EMA",
    "custodian_or_owner": "Legal Services / relevant technical unit",
    "km_value": "Authoritative legal reference",
    "priority": "High",
    "action_needed": "Capture metadata and version",
    "notes": null,
    "has_source_url": true,
    "has_direct_url": true,
    "keyword_common_group": [
      "air pollution",
      "air quality",
      "source emitter",
      "ambient monitoring",
      "air permit"
    ],
    "keyword_unique": [
      "air pollution fees regulations 2014",
      "ema km 0004",
      "air pollution fees",
      "air",
      "law"
    ],
    "keyword_discretionary": [